sentence,answer
"Peter is seventeen years old and Shay is seventeen years old . next year Peter is eighteen years old , and the age of Shay is [MASK] .",eighteen
"Janet is nineteen years old and Gerald is nineteen years old . next year Janet is twenty years old , and the age of Gerald is [MASK] .",twenty
"Audrey is thirteen years old and Lisa is thirteen years old . next year Audrey is fourteen years old , and the age of Lisa is [MASK] .",fourteen
"Nathan is ten years old and Fraser is ten years old . next year Nathan is eleven years old , and the age of Fraser is [MASK] .",eleven
"Amelia is ten years old and Adrian is ten years old . next year Amelia is eleven years old , and the age of Adrian is [MASK] .",eleven
"Wendy is ten years old and Lilly is ten years old . next year Wendy is eleven years old , and the age of Lilly is [MASK] .",eleven
"Kate is fifteen years old and Marie is fifteen years old . next year Kate is sixteen years old , and the age of Marie is [MASK] .",sixteen
"Madison is ten years old and Daryl is ten years old . next year Madison is eleven years old , and the age of Daryl is [MASK] .",eleven
"Morgan is eleven years old and Steven is eleven years old . next year Morgan is twelve years old , and the age of Steven is [MASK] .",twelve
"Emily is nineteen years old and Harris is nineteen years old . next year Emily is twenty years old , and the age of Harris is [MASK] .",twenty
"Ethan is fifteen years old and Robin is fifteen years old . next year Ethan is sixteen years old , and the age of Robin is [MASK] .",sixteen
"Sophie is sixteen years old and Sara is sixteen years old . next year Sophie is seventeen years old , and the age of Sara is [MASK] .",seventeen
"Evan is eleven years old and Garry is eleven years old . next year Evan is twelve years old , and the age of Garry is [MASK] .",twelve
"Theodore is fourteen years old and Justin is fourteen years old . next year Theodore is fifteen years old , and the age of Justin is [MASK] .",fifteen
"Danielle is ten years old and Louie is ten years old . next year Danielle is eleven years old , and the age of Louie is [MASK] .",eleven
"Bonnie is thirteen years old and Louis is thirteen years old . next year Bonnie is fourteen years old , and the age of Louis is [MASK] .",fourteen
"Luke is eleven years old and Elise is eleven years old . next year Luke is twelve years old , and the age of Elise is [MASK] .",twelve
"Pamela is sixteen years old and Morgan is sixteen years old . next year Pamela is seventeen years old , and the age of Morgan is [MASK] .",seventeen
"Lily is fourteen years old and Jay is fourteen years old . next year Lily is fifteen years old , and the age of Jay is [MASK] .",fifteen
"Florence is seventeen years old and Charlie is seventeen years old . next year Florence is eighteen years old , and the age of Charlie is [MASK] .",eighteen
"Nikki is eighteen years old and Corey is eighteen years old . next year Nikki is nineteen years old , and the age of Corey is [MASK] .",nineteen
"Gavin is thirteen years old and Stacy is thirteen years old . next year Gavin is fourteen years old , and the age of Stacy is [MASK] .",fourteen
"Barbara is nineteen years old and Tommy is nineteen years old . next year Barbara is twenty years old , and the age of Tommy is [MASK] .",twenty
"Harrison is sixteen years old and Emily is sixteen years old . next year Harrison is seventeen years old , and the age of Emily is [MASK] .",seventeen
"Faith is eleven years old and Laura is eleven years old . next year Faith is twelve years old , and the age of Laura is [MASK] .",twelve
"Casey is thirteen years old and Lynn is thirteen years old . next year Casey is fourteen years old , and the age of Lynn is [MASK] .",fourteen
"Hunter is nineteen years old and Scott is nineteen years old . next year Hunter is twenty years old , and the age of Scott is [MASK] .",twenty
"Heather is fourteen years old and Adam is fourteen years old . next year Heather is fifteen years old , and the age of Adam is [MASK] .",fifteen
"Marion is thirteen years old and Lara is thirteen years old . next year Marion is fourteen years old , and the age of Lara is [MASK] .",fourteen
"Mark is thirteen years old and Eleanor is thirteen years old . next year Mark is fourteen years old , and the age of Eleanor is [MASK] .",fourteen
"Marcus is ten years old and Harrison is ten years old . next year Marcus is eleven years old , and the age of Harrison is [MASK] .",eleven
"Anna is ten years old and Charlie is ten years old . next year Anna is eleven years old , and the age of Charlie is [MASK] .",eleven
"Jackson is ten years old and Alicia is ten years old . next year Jackson is eleven years old , and the age of Alicia is [MASK] .",eleven
"Allison is eleven years old and Andrew is eleven years old . next year Allison is twelve years old , and the age of Andrew is [MASK] .",twelve
"Robin is thirteen years old and Anthony is thirteen years old . next year Robin is fourteen years old , and the age of Anthony is [MASK] .",fourteen
"Elizabeth is fourteen years old and Linda is fourteen years old . next year Elizabeth is fifteen years old , and the age of Linda is [MASK] .",fifteen
"Bryan is eleven years old and Harley is eleven years old . next year Bryan is twelve years old , and the age of Harley is [MASK] .",twelve
"Alex is twelve years old and Jonathan is twelve years old . next year Alex is thirteen years old , and the age of Jonathan is [MASK] .",thirteen
"Bradley is fourteen years old and Harper is fourteen years old . next year Bradley is fifteen years old , and the age of Harper is [MASK] .",fifteen
"Angela is fifteen years old and Grant is fifteen years old . next year Angela is sixteen years old , and the age of Grant is [MASK] .",sixteen
"Harry is ten years old and Carolyn is ten years old . next year Harry is eleven years old , and the age of Carolyn is [MASK] .",eleven
"Samantha is ten years old and Lilly is ten years old . next year Samantha is eleven years old , and the age of Lilly is [MASK] .",eleven
"Nicholas is eleven years old and Stuart is eleven years old . next year Nicholas is twelve years old , and the age of Stuart is [MASK] .",twelve
"Faith is eleven years old and Joseph is eleven years old . next year Faith is twelve years old , and the age of Joseph is [MASK] .",twelve
"Richard is fourteen years old and Stephen is fourteen years old . next year Richard is fifteen years old , and the age of Stephen is [MASK] .",fifteen
"Lilly is nineteen years old and Kenneth is nineteen years old . next year Lilly is twenty years old , and the age of Kenneth is [MASK] .",twenty
"Daryl is nineteen years old and Edward is nineteen years old . next year Daryl is twenty years old , and the age of Edward is [MASK] .",twenty
"Bella is ten years old and Josh is ten years old . next year Bella is eleven years old , and the age of Josh is [MASK] .",eleven
"Mason is ten years old and Chloe is ten years old . next year Mason is eleven years old , and the age of Chloe is [MASK] .",eleven
"Gary is ten years old and Jill is ten years old . next year Gary is eleven years old , and the age of Jill is [MASK] .",eleven
"Douglas is thirteen years old and Julie is thirteen years old . next year Douglas is fourteen years old , and the age of Julie is [MASK] .",fourteen
"Lewis is eleven years old and Russell is eleven years old . next year Lewis is twelve years old , and the age of Russell is [MASK] .",twelve
"Jade is twelve years old and Hannah is twelve years old . next year Jade is thirteen years old , and the age of Hannah is [MASK] .",thirteen
"Donald is ten years old and Richard is ten years old . next year Donald is eleven years old , and the age of Richard is [MASK] .",eleven
"Roy is eleven years old and Dylan is eleven years old . next year Roy is twelve years old , and the age of Dylan is [MASK] .",twelve
"Brooke is seventeen years old and Roman is seventeen years old . next year Brooke is eighteen years old , and the age of Roman is [MASK] .",eighteen
"Peter is twelve years old and Bailey is twelve years old . next year Peter is thirteen years old , and the age of Bailey is [MASK] .",thirteen
"Kate is seventeen years old and Bella is seventeen years old . next year Kate is eighteen years old , and the age of Bella is [MASK] .",eighteen
"Kyle is nineteen years old and Kris is nineteen years old . next year Kyle is twenty years old , and the age of Kris is [MASK] .",twenty
"Catherine is sixteen years old and Danielle is sixteen years old . next year Catherine is seventeen years old , and the age of Danielle is [MASK] .",seventeen
"Roy is nineteen years old and Gerald is nineteen years old . next year Roy is twenty years old , and the age of Gerald is [MASK] .",twenty
"Ada is fourteen years old and Erin is fourteen years old . next year Ada is fifteen years old , and the age of Erin is [MASK] .",fifteen
"Melanie is thirteen years old and Grant is thirteen years old . next year Melanie is fourteen years old , and the age of Grant is [MASK] .",fourteen
"Barry is eleven years old and Darren is eleven years old . next year Barry is twelve years old , and the age of Darren is [MASK] .",twelve
"Mark is seventeen years old and Harvey is seventeen years old . next year Mark is eighteen years old , and the age of Harvey is [MASK] .",eighteen
"Amy is twelve years old and Cooper is twelve years old . next year Amy is thirteen years old , and the age of Cooper is [MASK] .",thirteen
"Henry is nineteen years old and Shay is nineteen years old . next year Henry is twenty years old , and the age of Shay is [MASK] .",twenty
