sentence,answer
"Jordan is the son of Madison , Audrey is the daughter of Neil , Marcus is the son of Isaac , and Bailey is the son of Robbie , So Madison is the parent of [MASK] .",Jordan
"Grayson is the son of Alexandra , Arthur is the son of Luke , Julia is the daughter of Kim , and Hannah is the daughter of Ellen , So Alexandra is the parent of [MASK] .",Grayson
"Paige is the daughter of Andrea , Henry is the son of Jessica , Lindsay is the daughter of Alexander , and Lindsey is the daughter of Stacy , So Andrea is the parent of [MASK] .",Paige
"Colin is the son of Sophia , Leigh is the daughter of Grace , Richard is the son of Caroline , and Henry is the son of Alex , So Sophia is the parent of [MASK] .",Colin
"Kimberly is the daughter of Richard , Jill is the daughter of Margaret , Gareth is the son of Chloe , and Audrey is the daughter of Daniel , So Richard is the parent of [MASK] .",Kimberly
"Amy is the daughter of Paige , Gerald is the son of Aaron , Stewart is the son of Autumn , and Fraser is the son of Taylor , So Paige is the parent of [MASK] .",Amy
"Lee is the son of George , Ronald is the son of Kerry , Nathan is the son of Alex , and Sarah is the daughter of Justin , So George is the parent of [MASK] .",Lee
"Jon is the son of Alison , Raymond is the son of Grayson , Richard is the son of Maya , and Alex is the son of Zac , So Alison is the parent of [MASK] .",Jon
"Alexis is the daughter of Danielle , Kimberly is the daughter of Anne , Harvey is the son of Abby , and Craig is the son of Judith , So Danielle is the parent of [MASK] .",Alexis
"Courtney is the daughter of Patricia , Quinn is the daughter of Amelia , Jennifer is the daughter of Nina , and Duncan is the son of Amber , So Patricia is the parent of [MASK] .",Courtney
"Autumn is the daughter of Melanie , Margaret is the daughter of Jude , Nova is the daughter of Charlotte , and Grant is the son of Josh , So Melanie is the parent of [MASK] .",Autumn
"Shirley is the daughter of Faith , Samuel is the son of Maya , Raymond is the son of Amelia , and Noah is the son of Scarlett , So Faith is the parent of [MASK] .",Shirley
"Blake is the son of Alexandra , Paige is the daughter of Fraser , Brooke is the daughter of Ada , and Joe is the son of Charlotte , So Alexandra is the parent of [MASK] .",Blake
"Michael is the son of Tommy , Robin is the son of Heather , Eve is the daughter of Hunter , and Nicole is the daughter of Denise , So Tommy is the parent of [MASK] .",Michael
"Lindsey is the daughter of Grace , Carol is the daughter of Rory , Cheryl is the daughter of Jordan , and Pamela is the daughter of Peter , So Grace is the parent of [MASK] .",Lindsey
"Amanda is the daughter of Eve , Lily is the daughter of Gareth , Jessica is the daughter of Catherine , and John is the son of Jordan , So Eve is the parent of [MASK] .",Amanda
"Shaun is the son of Keith , Rory is the son of Leah , Caroline is the daughter of Diane , and Robert is the son of Liam , So Keith is the parent of [MASK] .",Shaun
"Joey is the son of Alex , Sara is the daughter of Wayne , Mohammed is the son of Carolyn , and Eve is the daughter of Rebecca , So Alex is the parent of [MASK] .",Joey
"Craig is the son of Alison , Dawn is the daughter of Jennifer , Sonny is the son of Wendy , and Grace is the daughter of Charlotte , So Alison is the parent of [MASK] .",Craig
"Jon is the son of Elizabeth , Elise is the daughter of Kara , Gareth is the son of Cole , and Georgia is the daughter of Murray , So Elizabeth is the parent of [MASK] .",Jon
"Sophie is the daughter of Oscar , Josh is the son of Lena , Archie is the son of Judith , and Louie is the son of Nina , So Oscar is the parent of [MASK] .",Sophie
"Bailey is the son of Samuel , Megan is the daughter of Adam , Leo is the son of Scarlett , and Craig is the son of Alan , So Samuel is the parent of [MASK] .",Bailey
"Francis is the son of Joe , Bonnie is the daughter of Brandon , Nicola is the daughter of Charlie , and Ian is the son of Teddy , So Joe is the parent of [MASK] .",Francis
"Allison is the daughter of Ethan , Barry is the son of Nikki , Charlotte is the daughter of Aaron , and Summer is the daughter of Kerry , So Ethan is the parent of [MASK] .",Allison
"Aaron is the son of Ivy , Robbie is the son of Amanda , Daryl is the son of Neil , and Lee is the son of Quinn , So Ivy is the parent of [MASK] .",Aaron
"Julia is the daughter of Russell , Roy is the son of Christine , Alice is the daughter of Harris , and Daryl is the son of Logan , So Russell is the parent of [MASK] .",Julia
"Autumn is the daughter of Gavin , Sara is the daughter of Nicola , Lucy is the daughter of Luna , and Andrew is the son of Lynn , So Gavin is the parent of [MASK] .",Autumn
"Sam is the son of Kelly , Leigh is the daughter of Tyler , Shirley is the daughter of Charles , and Lauren is the daughter of Piper , So Kelly is the parent of [MASK] .",Sam
"Debbie is the daughter of Lois , Benjamin is the son of Scott , Jane is the daughter of Heather , and Laura is the daughter of Samantha , So Lois is the parent of [MASK] .",Debbie
"Charlie is the son of Lily , Murray is the son of Ian , Caroline is the daughter of Molly , and Madison is the daughter of Erin , So Lily is the parent of [MASK] .",Charlie
"Alison is the daughter of Jade , Hanna is the daughter of Marion , Hunter is the son of Graham , and Hannah is the daughter of Lilly , So Jade is the parent of [MASK] .",Alison
"Alison is the daughter of Grant , Duncan is the son of Ross , Gareth is the son of Michael , and Jude is the son of Madison , So Grant is the parent of [MASK] .",Alison
"Michael is the son of Rebecca , Gareth is the son of Hugh , Julia is the daughter of Hanna , and Diane is the daughter of Sarah , So Rebecca is the parent of [MASK] .",Michael
"Amy is the daughter of Frank , Marion is the daughter of Bryan , Allison is the daughter of Caleb , and Evan is the son of Garry , So Frank is the parent of [MASK] .",Amy
"Eleanor is the daughter of Fiona , Nikki is the daughter of Lois , Shirley is the daughter of Danielle , and Jennifer is the daughter of Melissa , So Fiona is the parent of [MASK] .",Eleanor
"Liam is the son of Hope , Bailey is the son of Edward , Carly is the daughter of Shaun , and Lara is the daughter of Heather , So Hope is the parent of [MASK] .",Liam
"Norman is the son of Chloe , Dale is the son of Linda , Lynn is the daughter of Ben , and Lara is the daughter of Eleanor , So Chloe is the parent of [MASK] .",Norman
"Carter is the son of Naomi , David is the son of Oliver , Suzanne is the daughter of Samantha , and Diane is the daughter of Laura , So Naomi is the parent of [MASK] .",Carter
"Jamie is the son of Hunter , Evan is the son of Catherine , Shaun is the son of Julia , and Carol is the daughter of Tracy , So Hunter is the parent of [MASK] .",Jamie
"Cole is the son of Josh , Robin is the son of Colin , Ruth is the daughter of Hugh , and Harris is the son of Taylor , So Josh is the parent of [MASK] .",Cole
"Angela is the daughter of Jackson , Jennifer is the daughter of James , Ann is the daughter of Claire , and Sophie is the daughter of Hayden , So Jackson is the parent of [MASK] .",Angela
"Autumn is the daughter of Clara , Amber is the daughter of Mia , Katie is the daughter of Bruce , and Paige is the daughter of Steven , So Clara is the parent of [MASK] .",Autumn
"Danielle is the daughter of Sara , Hunter is the son of Teddy , Connor is the son of Max , and Natalie is the daughter of Benjamin , So Sara is the parent of [MASK] .",Danielle
"Gary is the son of Anna , Clare is the daughter of Conor , Faith is the daughter of Hugh , and Joseph is the son of Maria , So Anna is the parent of [MASK] .",Gary
"Hayden is the son of Sara , Alexandra is the daughter of Ruth , Wendy is the daughter of Ann , and Noah is the son of Bailey , So Sara is the parent of [MASK] .",Hayden
"Edward is the son of Tyler , Shaun is the son of Lily , Piper is the daughter of Kim , and Frances is the daughter of Nathan , So Tyler is the parent of [MASK] .",Edward
"Naomi is the daughter of Willow , Jane is the daughter of Luna , Jason is the son of Barry , and Autumn is the daughter of Samantha , So Willow is the parent of [MASK] .",Naomi
"Maya is the daughter of Alexis , Carly is the daughter of Norman , Mark is the son of Sara , and Hugh is the son of Sarah , So Alexis is the parent of [MASK] .",Maya
"Louie is the son of Stewart , Wayne is the son of Sonny , Gerald is the son of Eden , and Kenneth is the son of Melissa , So Stewart is the parent of [MASK] .",Louie
"Campbell is the son of Nicola , Katie is the daughter of Bryan , Ashley is the daughter of Craig , and Cooper is the son of Valerie , So Nicola is the parent of [MASK] .",Campbell
"Roy is the son of Kathryn , Morgan is the son of Leah , Gareth is the son of Ian , and Jenna is the daughter of Gerard , So Kathryn is the parent of [MASK] .",Roy
"Lara is the daughter of Jordan , Victoria is the daughter of Clara , Raymond is the son of Alice , and Stuart is the son of Ian , So Jordan is the parent of [MASK] .",Lara
"Fraser is the son of Robbie , Karen is the daughter of Shirley , Kerry is the daughter of Taylor , and Jude is the son of Quinn , So Robbie is the parent of [MASK] .",Fraser
"Caroline is the daughter of Melissa , Caleb is the son of Scarlett , Adrian is the son of Alex , and Susan is the daughter of Frances , So Melissa is the parent of [MASK] .",Caroline
"Donna is the daughter of Calvin , Louise is the daughter of Jane , Jason is the son of Amy , and Paula is the daughter of Heidi , So Calvin is the parent of [MASK] .",Donna
"Derek is the son of Andrea , Kerry is the daughter of John , Ashley is the daughter of Jordan , and Harris is the son of Gerald , So Andrea is the parent of [MASK] .",Derek
"Duncan is the son of Donna , Robbie is the son of Campbell , Marcus is the son of Louis , and Isaac is the son of Edward , So Donna is the parent of [MASK] .",Duncan
"Ashley is the daughter of Alice , Angela is the daughter of Barry , Lucas is the son of Bonnie , and Samantha is the daughter of Kevin , So Alice is the parent of [MASK] .",Ashley
"Daniel is the son of Derek , Evan is the son of Hannah , Ada is the daughter of Shannon , and Helen is the daughter of Clara , So Derek is the parent of [MASK] .",Daniel
"Ethan is the son of Douglas , Cody is the son of Eric , Lauren is the daughter of Daisy , and Carrie is the daughter of Samuel , So Douglas is the parent of [MASK] .",Ethan
"Alexander is the son of Charlie , Stacy is the daughter of Sonny , Kris is the son of Alexandra , and Kyle is the son of Ellie , So Charlie is the parent of [MASK] .",Alexander
"Martin is the son of Jack , Scarlett is the daughter of Harley , Violet is the daughter of Sandra , and Duncan is the son of Ellis , So Jack is the parent of [MASK] .",Martin
"Elizabeth is the daughter of Nathan , James is the son of Rebecca , Janet is the daughter of Jacob , and Roy is the son of Cole , So Nathan is the parent of [MASK] .",Elizabeth
"Craig is the son of Alex , Sophia is the daughter of Francis , Derek is the son of Harley , and Cole is the son of John , So Alex is the parent of [MASK] .",Craig
"Frank is the son of Noah , Megan is the daughter of Ian , Adrian is the son of Ashley , and Louie is the son of Charlie , So Noah is the parent of [MASK] .",Frank
"Casey is the daughter of Lee , Edward is the son of Cheryl , Oliver is the son of Gordon , and Amy is the daughter of Donna , So Lee is the parent of [MASK] .",Casey
"Hope is the daughter of Summer , Julie is the daughter of Naomi , Ronald is the son of Jude , and Daryl is the son of Justin , So Summer is the parent of [MASK] .",Hope
"Harris is the son of Beth , Quinn is the daughter of Casey , Nina is the daughter of Taylor , and Lisa is the daughter of Richard , So Beth is the parent of [MASK] .",Harris
"Kai is the son of Peter , Sam is the son of Ellen , Liam is the son of Casey , and Patrick is the son of Elaine , So Peter is the parent of [MASK] .",Kai
"Jude is the son of Hazel , Margaret is the daughter of Ellie , Kevin is the son of Josh , and Donna is the daughter of Thomas , So Hazel is the parent of [MASK] .",Jude
"Jack is the son of Theo , Daryl is the son of Leo , Madison is the daughter of Cooper , and Charlie is the son of Allan , So Theo is the parent of [MASK] .",Jack
"Carter is the son of Chloe , Anne is the daughter of Corey , Gerard is the son of Hanna , and Jacob is the son of Barry , So Chloe is the parent of [MASK] .",Carter
"Philip is the son of Rory , Kara is the daughter of Kevin , Morgan is the son of Max , and James is the son of Colin , So Rory is the parent of [MASK] .",Philip
"Lee is the son of Alan , Harvey is the son of Owen , Nathan is the son of Jennifer , and Janet is the daughter of Steven , So Alan is the parent of [MASK] .",Lee
"Robin is the son of Bonnie , Jamie is the son of Harper , Amelia is the daughter of Dylan , and Lucy is the daughter of Paul , So Bonnie is the parent of [MASK] .",Robin
"Ada is the daughter of Piper , Francis is the son of Paige , Rachel is the daughter of Hugh , and Nicole is the daughter of Alice , So Piper is the parent of [MASK] .",Ada
"Kathleen is the daughter of Barbara , Lee is the son of Cooper , Isaac is the son of Ethan , and Russell is the son of Madison , So Barbara is the parent of [MASK] .",Kathleen
"Philip is the son of Jordan , Ross is the son of Alexander , Theo is the son of Joshua , and Cody is the son of Joe , So Jordan is the parent of [MASK] .",Philip
"Corey is the son of Fiona , Paige is the daughter of Ann , Peter is the son of Chelsea , and Hayden is the son of Carrie , So Fiona is the parent of [MASK] .",Corey
"Alicia is the daughter of Dylan , Roy is the son of Jamie , Liam is the son of Sara , and Abby is the daughter of Murray , So Dylan is the parent of [MASK] .",Alicia
"Jay is the son of Lindsay , Violet is the daughter of Shay , Sam is the son of Cheryl , and Russell is the son of Jackson , So Lindsay is the parent of [MASK] .",Jay
"Rachel is the daughter of Theo , Hayden is the son of Barbara , Sandra is the daughter of Peter , and Stephanie is the daughter of Shelley , So Theo is the parent of [MASK] .",Rachel
"Stuart is the son of Ellen , Stephen is the son of Debbie , Dean is the son of Holly , and Charles is the son of Carolyn , So Ellen is the parent of [MASK] .",Stuart
"Scott is the son of Mason , Cheryl is the daughter of Lee , Leon is the son of Leigh , and Hayden is the son of Stewart , So Mason is the parent of [MASK] .",Scott
"Kai is the son of Eva , Dawn is the daughter of Judith , Philip is the son of Ian , and Valerie is the daughter of Lucas , So Eva is the parent of [MASK] .",Kai
"Shay is the son of Katherine , Jade is the daughter of Brooke , Joey is the son of Raymond , and Rory is the son of Max , So Katherine is the parent of [MASK] .",Shay
"Andrea is the daughter of Scarlett , Ellis is the son of Rebecca , Hunter is the son of Jill , and Donald is the son of Lucas , So Scarlett is the parent of [MASK] .",Andrea
"Barry is the son of Beth , Noah is the son of Ben , Cameron is the son of Hugh , and Nicholas is the son of Willow , So Beth is the parent of [MASK] .",Barry
"Luna is the daughter of Anne , Riley is the son of Carol , Beth is the daughter of Arthur , and Shaun is the son of Kara , So Anne is the parent of [MASK] .",Luna
"Dawn is the daughter of Scott , Carrie is the daughter of Deborah , Gavin is the son of Elijah , and Amy is the daughter of Brian , So Scott is the parent of [MASK] .",Dawn
"Gerard is the son of Holly , Quinn is the daughter of Summer , Nathan is the son of Laura , and Kai is the son of Craig , So Holly is the parent of [MASK] .",Gerard
"Summer is the daughter of Anthony , Stacy is the daughter of Ashley , Suzanne is the daughter of Henry , and Jade is the daughter of Calvin , So Anthony is the parent of [MASK] .",Summer
"Blair is the son of Darren , Eva is the daughter of Casey , Jude is the son of Daniel , and Cody is the son of Joshua , So Darren is the parent of [MASK] .",Blair
"James is the son of Mia , Theodore is the son of Taylor , Kate is the daughter of Alexander , and Christina is the daughter of Paul , So Mia is the parent of [MASK] .",James
"Kara is the daughter of Evan , Judith is the daughter of Jonathan , Rosa is the daughter of Rachel , and Joey is the son of Molly , So Evan is the parent of [MASK] .",Kara
"Grayson is the son of George , Lilly is the daughter of Indie , Grant is the son of Craig , and Elaine is the daughter of Georgia , So George is the parent of [MASK] .",Grayson
"Elijah is the son of Jessica , Audrey is the daughter of Wayne , Florence is the daughter of Katie , and Noah is the son of Oscar , So Jessica is the parent of [MASK] .",Elijah
"Erin is the daughter of Grace , Louis is the son of Gerard , Julia is the daughter of Linda , and Lily is the daughter of Kim , So Grace is the parent of [MASK] .",Erin
"Campbell is the son of Eve , Mark is the son of Daniel , Anna is the daughter of Theo , and Blake is the son of Zac , So Eve is the parent of [MASK] .",Campbell
"Lena is the daughter of Hugh , Grace is the daughter of Mitchell , Jordan is the son of Kathleen , and Cooper is the son of Sophia , So Hugh is the parent of [MASK] .",Lena
"Elijah is the son of Summer , Bruce is the son of Eleanor , Scarlett is the daughter of Kai , and Lee is the son of Roman , So Summer is the parent of [MASK] .",Elijah
"Alexis is the daughter of Maria , Joshua is the son of Dylan , Grayson is the son of Ada , and Douglas is the son of Colin , So Maria is the parent of [MASK] .",Alexis
"Kris is the son of Marion , Leah is the daughter of Dylan , Jordan is the son of Kim , and Angela is the daughter of Lara , So Marion is the parent of [MASK] .",Kris
"Gareth is the son of Kimberly , Justin is the son of Naomi , Bruce is the son of Donna , and Peter is the son of Harvey , So Kimberly is the parent of [MASK] .",Gareth
"Hope is the daughter of Anne , Nikki is the daughter of Helen , Megan is the daughter of Tyler , and Amanda is the daughter of Suzanne , So Anne is the parent of [MASK] .",Hope
"Rachel is the daughter of Quinn , Douglas is the son of Brian , Calvin is the son of Allan , and Carter is the son of Peter , So Quinn is the parent of [MASK] .",Rachel
"Oscar is the son of Cooper , Chloe is the daughter of Wayne , Jenna is the daughter of Kevin , and Shaun is the son of Harper , So Cooper is the parent of [MASK] .",Oscar
"Russell is the son of Muhammad , Autumn is the daughter of Molly , Barry is the son of Rory , and Harry is the son of Naomi , So Muhammad is the parent of [MASK] .",Russell
"Gabriel is the son of Morgan , Kelly is the daughter of Emily , Carter is the son of Daniel , and Harley is the daughter of Catherine , So Morgan is the parent of [MASK] .",Gabriel
"Nicole is the daughter of Ryan , Bailey is the son of Jude , Morgan is the son of Elizabeth , and Lois is the daughter of Gary , So Ryan is the parent of [MASK] .",Nicole
"Lara is the daughter of Patricia , Nicole is the daughter of Catherine , Noah is the son of Amy , and Sophie is the daughter of Dean , So Patricia is the parent of [MASK] .",Lara
"Blake is the son of Dean , Jordan is the son of Nicola , Sara is the daughter of Norman , and Kate is the daughter of Helen , So Dean is the parent of [MASK] .",Blake
"Lindsay is the daughter of Kris , Leah is the daughter of Heather , Ada is the daughter of Ross , and Paige is the daughter of Carter , So Kris is the parent of [MASK] .",Lindsay
"Grayson is the son of Josh , Stephanie is the daughter of Conor , Oscar is the son of Hannah , and Louie is the son of Charlotte , So Josh is the parent of [MASK] .",Grayson
"Logan is the son of Colin , Hope is the daughter of Cheryl , Raymond is the son of Bryan , and Isaac is the son of Freddie , So Colin is the parent of [MASK] .",Logan
"Nina is the daughter of Harley , Ellie is the daughter of Eden , Julia is the daughter of Leah , and Lily is the daughter of Ronald , So Harley is the parent of [MASK] .",Nina
"Alex is the son of Joshua , Nicola is the daughter of Amanda , Carter is the son of Deborah , and Andrew is the son of Taylor , So Joshua is the parent of [MASK] .",Alex
"Lewis is the son of Marie , Cody is the son of Craig , Heidi is the daughter of Barry , and Elliot is the son of Helen , So Marie is the parent of [MASK] .",Lewis
"Jude is the son of Richard , Georgia is the daughter of Harry , Louis is the son of Kenneth , and Robin is the son of Scarlett , So Richard is the parent of [MASK] .",Jude
"Alison is the daughter of Elaine , Julie is the daughter of Carrie , Carol is the daughter of Suzanne , and Jacob is the son of Audrey , So Elaine is the parent of [MASK] .",Alison
"Josh is the son of Patrick , Christine is the daughter of Ellen , Jennifer is the daughter of Piper , and Rebecca is the daughter of Stuart , So Patrick is the parent of [MASK] .",Josh
"Frances is the daughter of Alan , Kim is the daughter of Gordon , Gary is the son of Lee , and Sophia is the daughter of Rebecca , So Alan is the parent of [MASK] .",Frances
"Elizabeth is the daughter of Kara , Lena is the daughter of Taylor , Patricia is the daughter of Sam , and Riley is the son of Amber , So Kara is the parent of [MASK] .",Elizabeth
"Amber is the daughter of Jenna , Ethan is the son of Valerie , Christine is the daughter of Lucas , and Samuel is the son of Gerald , So Jenna is the parent of [MASK] .",Amber
"Angus is the son of Olivia , Ronald is the son of Jennifer , Kai is the son of Neil , and Kara is the daughter of Harrison , So Olivia is the parent of [MASK] .",Angus
"Jude is the son of Amy , Caleb is the son of Peter , Ann is the daughter of Carly , and Cameron is the son of Lauren , So Amy is the parent of [MASK] .",Jude
"Leo is the son of Naomi , Kenneth is the son of Ruby , Cheryl is the daughter of Jordan , and Hanna is the daughter of Scott , So Naomi is the parent of [MASK] .",Leo
"Francis is the son of Shelley , Catherine is the daughter of Cheryl , Sharon is the daughter of Muhammad , and Allison is the daughter of Adrian , So Shelley is the parent of [MASK] .",Francis
"Gary is the son of Mitchell , Barry is the son of Joshua , Kathleen is the daughter of Ethan , and Mark is the son of Henry , So Mitchell is the parent of [MASK] .",Gary
"Ellen is the daughter of Dominic , Samantha is the daughter of Eva , Peter is the son of Carson , and Madison is the daughter of Benjamin , So Dominic is the parent of [MASK] .",Ellen
"Jackson is the son of Jennifer , Amelia is the daughter of Nathan , Robbie is the son of Taylor , and Bruce is the son of Janet , So Jennifer is the parent of [MASK] .",Jackson
"Patrick is the son of Maya , Bonnie is the daughter of Elizabeth , Caleb is the son of Charles , and Chelsea is the daughter of Lois , So Maya is the parent of [MASK] .",Patrick
"Rose is the daughter of Eric , Fiona is the daughter of Hope , Pamela is the daughter of Benjamin , and Sarah is the daughter of Daisy , So Eric is the parent of [MASK] .",Rose
"Graham is the son of Oscar , Andrew is the son of Rose , Julie is the daughter of Alexander , and Daryl is the son of Shaun , So Oscar is the parent of [MASK] .",Graham
"Emily is the daughter of Angus , Jessica is the daughter of Christina , Kate is the daughter of Matthew , and Daryl is the son of Taylor , So Angus is the parent of [MASK] .",Emily
"Alexandra is the daughter of Stephanie , Teddy is the son of Heidi , Dawn is the daughter of Leigh , and Samantha is the daughter of James , So Stephanie is the parent of [MASK] .",Alexandra
"Beth is the daughter of Charles , Leo is the son of Kate , Elaine is the daughter of Lee , and Piper is the daughter of Alexis , So Charles is the parent of [MASK] .",Beth
"Marc is the son of Joseph , Henry is the son of Elijah , Neil is the son of Michael , and Mohammed is the son of Eden , So Joseph is the parent of [MASK] .",Marc
"Ryan is the son of Natalie , Fiona is the daughter of Wesley , Aaron is the son of Quinn , and Kerry is the daughter of Thomas , So Natalie is the parent of [MASK] .",Ryan
"Evan is the son of Carolyn , Grayson is the son of Madison , Cameron is the son of Greg , and Barbara is the daughter of Michael , So Carolyn is the parent of [MASK] .",Evan
"Lewis is the son of Frank , Evan is the son of Ian , Gerald is the son of Justin , and Peter is the son of Sam , So Frank is the parent of [MASK] .",Lewis
"Jack is the son of Colin , Bella is the daughter of Linda , Elijah is the son of Courtney , and Gary is the son of Naomi , So Colin is the parent of [MASK] .",Jack
"Carolyn is the daughter of Neil , Beth is the daughter of Lindsay , Ellen is the daughter of Peter , and Louise is the daughter of Kim , So Neil is the parent of [MASK] .",Carolyn
"Shaun is the son of Naomi , Anthony is the son of Kathryn , Henry is the son of Sandra , and Murray is the son of Pamela , So Naomi is the parent of [MASK] .",Shaun
"Melissa is the daughter of Emma , Autumn is the daughter of Holly , Hope is the daughter of Madison , and Mia is the daughter of Connor , So Emma is the parent of [MASK] .",Melissa
"Gordon is the son of Matthew , Molly is the daughter of Sonny , Laura is the daughter of James , and Carly is the daughter of Nicholas , So Matthew is the parent of [MASK] .",Gordon
"Sam is the son of Ashley , Eric is the son of Colin , Wendy is the daughter of Raymond , and Jude is the son of Teddy , So Ashley is the parent of [MASK] .",Sam
"Aaron is the son of Donna , Paige is the daughter of Lucy , Melissa is the daughter of Sara , and Stewart is the son of Harris , So Donna is the parent of [MASK] .",Aaron
"Shannon is the daughter of Zac , Paul is the son of Lindsay , Richard is the son of Taylor , and Debbie is the daughter of Kathryn , So Zac is the parent of [MASK] .",Shannon
