sentence,answer
"Clare is the daughter of Connor , and Frances is the daughter of Ryan , So Connor is the parent of [MASK] .",Clare
"Caleb is the son of Joe , and Leigh is the daughter of Archie , So Joe is the parent of [MASK] .",Caleb
"Teddy is the son of Ellen , and Barbara is the daughter of Ruby , So Ellen is the parent of [MASK] .",Teddy
"Kara is the daughter of Elaine , and Robbie is the son of Eric , So Elaine is the parent of [MASK] .",Kara
"Robin is the son of Charlotte , and Deborah is the daughter of Indie , So Charlotte is the parent of [MASK] .",Robin
"Marion is the daughter of Jackson , and Louis is the son of Piper , So Jackson is the parent of [MASK] .",Marion
"Sarah is the daughter of Wayne , and Mia is the daughter of Stewart , So Wayne is the parent of [MASK] .",Sarah
"Kelly is the daughter of Harry , and Adam is the son of Hazel , So Harry is the parent of [MASK] .",Kelly
"Lucas is the son of Bonnie , and Cheryl is the daughter of Carly , So Bonnie is the parent of [MASK] .",Lucas
"Frank is the son of Amber , and Indie is the daughter of Josh , So Amber is the parent of [MASK] .",Frank
"Campbell is the son of Susan , and Theo is the son of Mia , So Susan is the parent of [MASK] .",Campbell
"Scott is the son of Aaron , and Raymond is the son of Lewis , So Aaron is the parent of [MASK] .",Scott
"Cooper is the son of Heather , and Lee is the son of Scott , So Heather is the parent of [MASK] .",Cooper
