sentence,answer
"Justin is the son of Joshua , Kevin is the son of Jessica , and Neil is the son of Anthony , So Joshua is the parent of [MASK] .",Justin
"Gerard is the son of Elise , Ross is the son of Bryan , and Malcolm is the son of Casey , So Elise is the parent of [MASK] .",Gerard
"Finn is the son of Norman , Anthony is the son of Caleb , and Kathleen is the daughter of Gavin , So Norman is the parent of [MASK] .",Finn
"Kim is the daughter of Henry , Blake is the son of Nicole , and Scarlett is the daughter of Aaron , So Henry is the parent of [MASK] .",Kim
"Katherine is the daughter of Liam , Freddie is the son of Samuel , and Denise is the daughter of Frankie , So Liam is the parent of [MASK] .",Katherine
"Wendy is the daughter of Paige , Beth is the daughter of Caleb , and Samantha is the daughter of Katrina , So Paige is the parent of [MASK] .",Wendy
"Angus is the son of Carter , Kevin is the son of Brandon , and Lynn is the daughter of Ivy , So Carter is the parent of [MASK] .",Angus
"Nova is the daughter of Finn , Henry is the son of Allan , and Thomas is the son of Edward , So Finn is the parent of [MASK] .",Nova
"Jason is the son of Frankie , Teddy is the son of Karen , and Harry is the son of Norman , So Frankie is the parent of [MASK] .",Jason
"Ann is the daughter of Craig , Melanie is the daughter of Jamie , and Connor is the son of Mohammed , So Craig is the parent of [MASK] .",Ann
"Violet is the daughter of Adrian , Ruth is the daughter of Sophia , and Shay is the son of Mohammed , So Adrian is the parent of [MASK] .",Violet
"Piper is the daughter of Joshua , Andrea is the daughter of Angus , and Grace is the daughter of Bryan , So Joshua is the parent of [MASK] .",Piper
"Helen is the daughter of Daisy , Mark is the son of Audrey , and Bailey is the son of Blake , So Daisy is the parent of [MASK] .",Helen
"Melissa is the daughter of Elliot , Hunter is the son of Clare , and Raymond is the son of Lisa , So Elliot is the parent of [MASK] .",Melissa
"Hannah is the daughter of Susan , Sharon is the daughter of Joshua , and Cole is the son of Duncan , So Susan is the parent of [MASK] .",Hannah
"Connor is the son of Amanda , Oliver is the son of Cameron , and Liam is the son of Luna , So Amanda is the parent of [MASK] .",Connor
"Victoria is the daughter of Peter , Connor is the son of Teddy , and Ethan is the son of Jessica , So Peter is the parent of [MASK] .",Victoria
"Raymond is the son of Lee , Hunter is the son of Sean , and Lindsay is the daughter of Ronald , So Lee is the parent of [MASK] .",Raymond
"Rose is the daughter of Kara , George is the son of Caroline , and Helen is the daughter of Sonny , So Kara is the parent of [MASK] .",Rose
"Louie is the son of Hayden , Nina is the daughter of Luna , and Jessica is the daughter of Brandon , So Hayden is the parent of [MASK] .",Louie
"Dylan is the son of Louie , Carly is the daughter of Dawn , and Claire is the daughter of Paul , So Louie is the parent of [MASK] .",Dylan
"Zac is the son of Audrey , Nova is the daughter of Max , and Jon is the son of Rebecca , So Audrey is the parent of [MASK] .",Zac
"Russell is the son of Morgan , Philip is the son of Elliot , and James is the son of Julia , So Morgan is the parent of [MASK] .",Russell
"Lisa is the daughter of Mia , Oliver is the son of Sam , and Theo is the son of Matthew , So Mia is the parent of [MASK] .",Lisa
"Emily is the daughter of Gabriel , Natasha is the daughter of Derek , and Fraser is the son of Marcus , So Gabriel is the parent of [MASK] .",Emily
"Frank is the son of Joseph , Christina is the daughter of Leo , and Wendy is the daughter of Benjamin , So Joseph is the parent of [MASK] .",Frank
"Cameron is the son of Zac , Samuel is the son of Jamie , and Clare is the daughter of Logan , So Zac is the parent of [MASK] .",Cameron
"Amy is the daughter of Caroline , Taylor is the son of Fraser , and Harry is the son of Liam , So Caroline is the parent of [MASK] .",Amy
"Ronald is the son of Pamela , Barry is the son of Simon , and Lucy is the daughter of Naomi , So Pamela is the parent of [MASK] .",Ronald
"Danielle is the daughter of Sandra , Nova is the daughter of Heidi , and Gavin is the son of Ada , So Sandra is the parent of [MASK] .",Danielle
"Heather is the daughter of Nicola , Joshua is the son of Riley , and Gordon is the son of Murray , So Nicola is the parent of [MASK] .",Heather
"Gordon is the son of Theo , Amanda is the daughter of Harrison , and Harper is the daughter of Chelsea , So Theo is the parent of [MASK] .",Gordon
"Marcus is the son of Brandon , Carolyn is the daughter of Morgan , and Ryan is the son of Nicola , So Brandon is the parent of [MASK] .",Marcus
"Sharon is the daughter of Charles , Riley is the son of Alexander , and Corey is the son of Robbie , So Charles is the parent of [MASK] .",Sharon
"Paula is the daughter of Theodore , Harley is the daughter of Ian , and Sean is the son of Mitchell , So Theodore is the parent of [MASK] .",Paula
"Jonathan is the son of Nathan , Carolyn is the daughter of Ellen , and Michelle is the daughter of Jude , So Nathan is the parent of [MASK] .",Jonathan
"Max is the son of Bruce , Faith is the daughter of Aurora , and Lynn is the daughter of Kimberly , So Bruce is the parent of [MASK] .",Max
"Gavin is the son of Mark , Christina is the daughter of Bradley , and Katrina is the daughter of Frankie , So Mark is the parent of [MASK] .",Gavin
"Harvey is the son of Adam , Morgan is the son of Christine , and Melissa is the daughter of Owen , So Adam is the parent of [MASK] .",Harvey
"Carter is the son of Jennifer , Gordon is the son of Joshua , and Eva is the daughter of Freddie , So Jennifer is the parent of [MASK] .",Carter
"Allison is the daughter of Patricia , Joseph is the son of Karen , and Chelsea is the daughter of Nicholas , So Patricia is the parent of [MASK] .",Allison
"Leo is the son of Raymond , Fraser is the son of Dale , and Steven is the son of Harley , So Raymond is the parent of [MASK] .",Leo
"Cheryl is the daughter of Theo , Maya is the daughter of Emma , and Arthur is the son of Elijah , So Theo is the parent of [MASK] .",Cheryl
"Colin is the son of Theodore , Joseph is the son of Georgia , and Suzanne is the daughter of Marcus , So Theodore is the parent of [MASK] .",Colin
"Naomi is the daughter of Robbie , Olivia is the daughter of Hope , and Piper is the daughter of Corey , So Robbie is the parent of [MASK] .",Naomi
"Lois is the daughter of Sophie , Richard is the son of Nicole , and Oliver is the son of Mary , So Sophie is the parent of [MASK] .",Lois
"Joey is the son of Karen , Theo is the son of Dean , and Grant is the son of Joshua , So Karen is the parent of [MASK] .",Joey
"David is the son of Joshua , Kara is the daughter of Kris , and Blake is the son of Dawn , So Joshua is the parent of [MASK] .",David
"Brooke is the daughter of Marc , Julia is the daughter of Naomi , and Clara is the daughter of Theodore , So Marc is the parent of [MASK] .",Brooke
"Dominic is the son of Justin , Allison is the daughter of Luna , and Teddy is the son of Richard , So Justin is the parent of [MASK] .",Dominic
"Julie is the daughter of Blake , Holly is the daughter of Tommy , and Logan is the son of Karen , So Blake is the parent of [MASK] .",Julie
"Piper is the daughter of Violet , Sara is the daughter of Lara , and Samuel is the son of Louise , So Violet is the parent of [MASK] .",Piper
"Megan is the daughter of Charlie , Claire is the daughter of Natalie , and Dean is the son of Carter , So Charlie is the parent of [MASK] .",Megan
"Olivia is the daughter of Summer , Norman is the son of Rachel , and Lindsay is the daughter of Blake , So Summer is the parent of [MASK] .",Olivia
"Carrie is the daughter of Patrick , Hayden is the son of Heather , and Jon is the son of Ellis , So Patrick is the parent of [MASK] .",Carrie
"Mary is the daughter of Joseph , Harvey is the son of Alex , and Elise is the daughter of Carly , So Joseph is the parent of [MASK] .",Mary
"Shay is the son of Alex , William is the son of Leo , and Madison is the daughter of Erin , So Alex is the parent of [MASK] .",Shay
"Amy is the daughter of Caleb , Alice is the daughter of Deborah , and Samuel is the son of Eva , So Caleb is the parent of [MASK] .",Amy
"Christine is the daughter of Archie , Elaine is the daughter of Daryl , and Alison is the daughter of Heidi , So Archie is the parent of [MASK] .",Christine
"Linda is the daughter of Natalie , Grayson is the son of Noah , and Katie is the daughter of Madison , So Natalie is the parent of [MASK] .",Linda
"Amelia is the daughter of Valerie , Ruth is the daughter of Isaac , and Fraser is the son of Kathryn , So Valerie is the parent of [MASK] .",Amelia
"Darren is the son of Amy , Gabriel is the son of Alice , and Francis is the son of Jay , So Amy is the parent of [MASK] .",Darren
"Jessica is the daughter of Alison , Graham is the son of Naomi , and Lois is the daughter of Oscar , So Alison is the parent of [MASK] .",Jessica
"Sarah is the daughter of Harley , Heather is the daughter of Carrie , and Samantha is the daughter of Jamie , So Harley is the parent of [MASK] .",Sarah
"Ann is the daughter of Susan , Darren is the son of Danielle , and Teddy is the son of Elliot , So Susan is the parent of [MASK] .",Ann
